SEASON,CLUE VALUE,CLUE CATEGORY,QUESTION,OUR MODEL_ANSWER,REAL ANSWER,CORRECT,CONTEXT USED
34,800,HISTORY OF SCIENCE,"In 1880 Alphonse Laveran discovered that parasites caused this disease named for the ""bad air"" thought to cause it","malaria (then called ""Marsh Fever"") was a protozoan parasite,",malaria,True,"Globalization and disease . On Nov. 6, 1880 Alphonse Laveran discovered that malaria (then called ""Marsh Fever"") was a protozoan parasite, and that mosquitoes carry and transmit malaria. Malaria is a protozoan infectious disease that is generally transmitted to humans by mosquitoes between dusk and dawn. The European variety, known as ""vivax"" after the ""Plasmodium vivax"" parasite, causes a relatively mild, yet chronically aggravating disease. The west African variety is caused by the sporozoan parasite, ""Plasmodium falciparum"", and results in a severely debilitating and deadly disease."
34,1200,HISTORY OF SCIENCE,There would be no sodas without the invention of carbonated water by this scientist as part of his 18th c. oxygen studies,Joseph Priestley,Joseph Priestley,True,"Soft drink . In the late 18th century, scientists made important progress in replicating naturally carbonated mineral waters. In 1767, Englishman Joseph Priestley first discovered a method of infusing water with carbon dioxide to make carbonated water when he suspended a bowl of distilled water above a beer vat at a local brewery in Leeds, England. His invention of carbonated water (also known as soda water) is the major and defining component of most soft drinks."
34,1600,HISTORY OF SCIENCE,Around 1929 this physicist with labs later named for him built the first cyclotron to produce artificial radioactivity,Ernest Orlando Lawrence,Ernest Lawrence,False,"Sándor Gaál . Most credible international sources give the credit of the invention of the cyclotron to American physicist and Nobel Laureate Ernest Orlando Lawrence, who invented the cyclotron during the spring of 1929 and built the first operational cyclotron in 1930 while at the University of California, Berkeley. In November 1939, Ernest O. Lawrence was awarded the Nobel Prize in Physics for his work on the cyclotron and its applications."
34,2000,HISTORY OF SCIENCE,"In 1807 President Jefferson created the Coast Survey; today, it's part of this oceanic agency","United States Survey of the Coast, created within the United States Department of the Treasury",NOAA (the National Oceanic and Atmospheric Administration),False,"U.S. National Geodetic Survey . The original predecessor agency of the National Geodetic Survey was the United States Survey of the Coast, created within the United States Department of the Treasury by an Act of Congress on February 10, 1807, to conduct a ""Survey of the Coast."" The Survey of the Coast, the United States governments first scientific agency, represented the interest of the administration of President Thomas Jefferson in science and the stimulation of international trade by using scientific surveying methods to chart the waters of the United States and make them safe for navigation. A Swiss immigrant with expertise in both surveying and the standardization of weights and measures, Ferdinand R. Hassler, was selected to lead the Survey."
34,800,SPANISH WORDS & PHRASES,"Cesar Chavez heard Latino leaders say ""No se puede"" & immediately his United Farm Workers had this slogan","Spanish for ""Yes, one can"" or, roughly, ""Yes, it can be done""","Sí, se puede",False,"Cesar Chavez . During his lifetime, Colegio Cesar Chavez was one of the few institutions named in his honor, but after his death he became a major historical icon for the Latino community, with many schools, streets, and parks being named after him. He has since become an icon for organized labor and leftist politics, symbolizing support for workers and for Hispanic empowerment based on grass roots organizing. He is also famous for popularizing the slogan ""Sí, se puede"" (Spanish for ""Yes, one can"" or, roughly, ""Yes, it can be done""), which was adopted as the 2008 campaign slogan of Barack Obama. Although the UFW faltered a few years after Chavez died in 1993, his work led to numerous improvements for union laborers. He has since become an iconic ""folk saint"" in the pantheon of Mexican Americans. His birthday, March 31, is a federal commemorative holiday (Cesar Chavez Day) observed by several states in the US. He received many honors and accolades, while still living and after his death, including the Presidential Medal of Freedom in 1994."
34,1200,SPANISH WORDS & PHRASES,Order camarones in a restaurant & you'll get this seafood,Seafood restaurant,shrimp,False,"Seafood restaurant . A seafood restaurant is a restaurant that specializes in seafood cuisine and seafood dishes, such as fish and shellfish. Dishes may include freshwater fish. The concept may focus upon the preparation and service of fresh seafood, (as opposed to frozen products). Some seafood restaurants also provide retail sales of seafood that consumers take home to prepare. Seafood restaurants may have a marine-themed decor, with decorations such as fish nets, nautical images and buoys. Fare can vary due to seasonality in fish availability and in the fishing industry. Seafood restaurants may offer additional non-seafood items, such as chicken and beef dishes."
34,1600,SPANISH WORDS & PHRASES,"It means ""market"" & precedes bursatil to mean ""stock market\""",there is a functioning market in the exchange of private titles to the means of production,mercado,False,"Stock market . As the Austrian School economist Ludwig von Mises noted, ""A stock market is crucial to the existence of capitalism and private property. For it means that there is a functioning market in the exchange of private titles to the means of production. There can be no genuine private ownership of capital without a stock market: there can be no true socialism if such a market is allowed to exist."""
34,2000,SPANISH WORDS & PHRASES,"\""¿Cómo estás?"" is casual; ""¿cómo está"" this pronoun, more formal",¿Cómo está?.),usted,False,"We . A similar usage exists in other languages. For example, José Luis Properzi of Argentine rock band Super Ratones revealed that the title of their song ""¿Cómo estamos hoy, eh?"" (""How are we today, eh?"") was the greeting a taxi driver addressed to him. (Regular Spanish ""How are you?"" greetings are ¿Cómo estás? or, more formal, ¿Cómo está?.)"
34,400,IT HAPPENED IN EUROPE,In 1453 the Turks captured Constantinople & killed the 11th emperor there to have this very appropriate name,"Constantine Palaeologus,",Constantine,True,"Francis of Paola . It was believed that Francis was favored with the gift of prophecy. He apparently foretold to several persons, in the years 1447, 1448, and 1449, the taking of Constantinople by the Turks, which happened on 29 May 1453, under the command of Mahomet II, when Constantine Palaeologus, the last Christian emperor, was killed in battle. He also predicted the capture of Otranto by the Ottoman Turks in 1480, and its subsequent recovery by the King of Naples."
34,800,IT HAPPENED IN EUROPE,In spring 1939 the U.K. instituted this compulsory measure in peacetime for the first time,,the draft,False,No Context
34,1200,IT HAPPENED IN EUROPE,"A symbol of this intellectual movement, Frederick II was dubbed ""philosopher king\""","philosophically-oriented Frederick II, Berlin gave birth to an intellectual renaissance in which it became one of the most important centers of the Enlightenment in Europe.",the Enlightenment,True,"Berlin Enlightenment . In 1740 Frederick II, known as Frederick the Great, came to power in the Kingdom of Prussia. Under the rule of the philosophically-oriented Frederick II, Berlin gave birth to an intellectual renaissance in which it became one of the most important centers of the Enlightenment in Europe. The city was an important book and press location, as well as the new home of many drama groups. Later, it hosted a National Theatre, the Academy of the Arts and the Academy of Sciences."
34,1600,IT HAPPENED IN EUROPE,In 1622 this cardinal was elected president of the Sorbonne & began rebuilding the university; he's buried in its chapel,Richelieu,Richelieu,True,"College of Sorbonne . Sorbon purchased several houses on Rue Coupe-Gueule (now Rue de la Sorbonne) and made them into lodging for students. The college opened in 1257 with about twenty students, called ""socii"". As the college grew, Sorbon provided a library containing over a thousand volumes by 1292, the largest in the university, and a chapel.  The Sorbonne became the most distinguished theological institution in France, and its doctors were frequently called upon to render opinions on important ecclesiastical and theological issues. In 1470, the Sorbonne had one of the first printing presses in France. It was particularly active in the effort to suppress heresy and the spread of Protestant doctrines. Its students included Cardinal Richelieu, who studied there from 1606 to 1607. Richelieu became Proviseur, or administrator of the college on 29 August 1622. Between 1635 and 1642, Richelieu renovated the Sorbonne; he consolidated the Sorbonne with two smaller colleges, and built a complex of new buildings, including a domed chapel, around a large courtyard. Richelieu left a large part of his fortune and his library to the Sorbonne, and he was buried in the chapel. Only the chapel remains of the Richelieu era buildings."
34,2000,IT HAPPENED IN EUROPE,King Zog I ruled this Balkan country until 1939; Communist Enver Hoxha would lead it from 1944 to 1985,Albania,Albania,True,"Enver Hoxha . Enver Halil Hoxha (; ; 16 October 190811 April 1985) was an Albanian communist politician who served as the head of state of Albania from 1944 until his death in 1985, as the First Secretary of the Party of Labour of Albania. He was chairman of the Democratic Front of Albania and commander-in-chief of the armed forces from 1944 until his death. He served as the 22nd Prime Minister of Albania from 1944 to 1954 and at various times served as foreign minister and defence minister as well."
34,0,ARTISTS & AUTHORS,In 1929 Georgia O'Keeffe painted the tree in New Mexico under which this British-born author used to write,Stieglitz,D.H. Lawrence,False,"Georgia O'Keeffe . O'Keeffe and Stieglitz lived together in New York until 1929, when O'Keeffe began spending part of the year in the Southwest, which served as inspiration for her paintings of New Mexico landscapes and images of animal skulls, such as """" and ""Ram's Head White Hollyhock and Little Hills."" After Stieglitz's death, she lived permanently in New Mexico at Georgia O'Keeffe Home and Studio in Abiquiú, until the last years of her life when she lived in Santa Fe. In 2014, O'Keeffe's 1932 painting ""Jimson Weed"" sold for $44,405,000, more than three times the previous world auction record for any female artist. After her death, the Georgia O'Keeffe Museum was established in Santa Fe."
34,200,ART & ARTISTS,"This artist who portrayed the Moulin Rouge in his paintings was a character in the film ""Moulin Rouge!\""",Henri de Toulouse-Lautrec.,(Toulouse) Lautrec,False,"At the Moulin Rouge . At the Moulin Rouge () is an oil-on-canvas painting by French artist Henri de Toulouse-Lautrec. It was painted between 1892 and 1895. It is one of a number of works by Toulouse-Lautrec depicting the Moulin Rouge cabaret built in Paris in 1889; the others include ""At the Moulin Rouge, The Dance"" and the poster """"."
34,400,ART & ARTISTS,"One of her paintings of the 1940s is ""Over the River to Grandma's House"" (was it her own house?)",,Grandma Moses,False,No Context
34,600,ART & ARTISTS,"Dürer depicted this Roman hero at labor, shooting the man-eating birds of the Stymphalian marshes",Heracles.,Hercules,False,"Northern bald ibis . Herodotus wrote of the man-eating Stymphalian birds, which had wings of brass and sharp metallic feathers they could fire at their victims. Ridding Lake Stymphalia in Arcadia of these creatures was one of the twelve labours of Heracles. These mythical birds are sometimes considered to be based on the northern bald ibis, but since they were described as marsh birds, and usually depicted without crests, the legendary species is more likely to be derived from the sacred ibis. Some depictions, such as the 6th-century BC Athenian black-figure amphora in the British Museum, clearly show the black head and white body of the sacred ibis. After the bald ibis became extinct in Central Europe, some later writers thought that Gesner's description was one of several in his book depicting mythical creatures."
34,800,ART & ARTISTS,"Discovered on an Aegean island on April 8, 1820, this marble statue was presented to Louis XVIII, who donated it to the Louvre",Venus de Milo,the Venus de Milo,True,"Louis Nicolas Philippe Auguste de Forbin . Some remnants of Antiquity from the tour entered the Louvre, but the coup was the acquisition of the Venus de Milo, discovered in 1820. The Director-General of Royal Museums was able to get Louis XVIII to set aside political distaste and authorize the purchase of David's ""Rape of the Sabine Women"" and ""Thermopyle"" for the Louvre, and, even more daring Théodore Géricault's ""The Raft of the Medusa"", which Forbin had been pressing as a royal purchase, and which was eventually bought from the painter's heirs in 1824."
34,1000,ART & ARTISTS,"Though the Spanish court painter, he portrayed the vulgarity of the family of Charles IV",Carlos IV is broadly seen as an idler,Francisco Goya,False,"Charles IV in his Hunting Clothes . Charles IV in his Hunting Clothes is an oil on canvas painting of 1799 by the Spanish artist Francisco Goya, the second of his two portraits of King Charles IV of Spain. Goya had earlier been court painter to Charles III, who was widely viewed as the more astute political operator of the pair. While not lacking intelligence, Carlos IV is broadly seen as an idler compared to his father; ultimately he was outmaneuvered by Napoleon at a time when he was more interested in sport and hunting than affairs of state. While Goya devotes a great deal of attention to his depiction of the king's sash and cloth, he emphasises his weakness in his rendering of a near-portly belly and indecisive stare. The art critic Robert Hughes describes a ""big nosed face, framed in the tricorned hat like the head of an affable turtle poking from its shell"". During his career, Goya depicted both father and son in hunting dress. The inspiration for the older man's outfit is probably taken from Velázquez's portrait of Philip IV, which the artist would have opportunity to see as then court painter. Goya pays tribute to Titian's ""Portrait of Charles V with a dog"" by depicting a dog loyally sniffing at the royal crotch."
34,200,ALSO A BASEBALL WORD,A bargain so amazing it's almost like you're paying nothing,,a steal,False,No Context
34,400,ALSO A BASEBALL WORD,You pour it to make pancakes,"Bisquick,",batter,False,"Knots Untie . As Rick's group prep the RV for the trip, Denise gives Daryl some oat-cakes as thanks for his previous efforts. Carl tells Rick that he accepts Rick and Michonne's relationship, and turns down an invitation to go with them, joking that he would not make a good impression with his messed-up face. After heading out, Abraham quietly asks Glenn, ""While you were pouring the Bisquick, were you trying to make pancakes?"" Glenn explains that he and Maggie are trying to build something, that they all are. On the way, they see a vehicle smoking as a result of a wreck. Jesus says it's his people, and Rick's group tracks them to a nearby building and rescues them from walkers."
34,600,ALSO A BASEBALL WORD,In 1894 the federal government used an injunction to break up a railway one of these,charged unnamed strikers with conspiracy for interfering with interstate commerce and the mails,a strike,False,"Peter S. Grosscup . According to Almont Lindsey, federal judges Peter Grosscup and William Woods issued the first omnibus injunction against the Pullman railroad strikers in Chicago protecting 22 railroads on July 2, 1894. This innovative use of a federal injunction charged unnamed strikers with conspiracy for interfering with interstate commerce and the mails thus putting the federal courts at the disposal of corporations to break strikes. The July 3, 1894 ""New York Times"" called the injunction a “Gatling gun on paper.”"
34,800,ALSO A BASEBALL WORD,"A result of tar distillation, or a sales spiel directed your way",destructive,pitch,False,Pine tar . Pine tar is a sticky material produced by the high temperature carbonization of pine wood in anoxic conditions (dry distillation or destructive distillation). The wood is rapidly decomposed by applying heat and pressure in a closed container; the primary resulting products are charcoal and pine tar.
34,200,VICKI LEAKS,Victoria Woodhull's weekly was the first American magazine to publish this Marx-Engels opus in English,"Karl Marx's ""Communist Manifesto",The Communist Manifesto,False,"Victoria Woodhull . On the date of May 14, 1870, Woodhull and Claflin used the money they had made from their brokerage to found a newspaper, the ""Woodhull & Claflin's Weekly"", which at its height had national circulation of 20,000. Its primary purpose was to support Victoria Claflin Woodhull for President of the United States. Published for the next six years, feminism was the ""Weekly""'s primary interest, but it became notorious for publishing controversial opinions on taboo topics, advocating among other things sex education, free love, women's suffrage, short skirts, spiritualism, vegetarianism, and licensed prostitution. History often states the paper advocated birth control, but some historians disagree. The paper is now known for printing the first English version of Karl Marx's ""Communist Manifesto"" in its edition of December 30, 1871, and the paper argued the cause of labor with eloquence and skill. James Blood and Stephen Pearl Andrews wrote the majority of the articles, as well as other able contributors."
34,400,VICKI LEAKS,It's a shoe in—the Roman goddess Victoria was the equivalent of this Greek goddess,Nike,Nike,True,"Victoria (mythology) . Victoria (), in ancient Roman religion, was the personified goddess of victory. She is the Roman equivalent of the Greek goddess Nike, and was associated with Bellona. She was adapted from the Sabine agricultural goddess Vacuna and had a temple on the Palatine Hill. The goddess Vica Pota was also sometimes identified with Victoria. Victoria is often described as a daughter of Pallas and Styx, and as a sister of Zelus, Kratos, and Bia."
34,600,VICKI LEAKS,"In Houston with husband Joel, Victoria Osteen is a ""co-"" one of these, from the Latin for ""shepherd\""",author,pastor,False,"Victoria Osteen . Victoria Osteen (born March 28, 1961) is the co-pastor of Lakewood Church in Houston, Texas, an author, the wife of Joel Osteen, and the daughter-in-law of John Osteen."
34,800,VICKI LEAKS,"Austrian-born Vicki Baum wrote ""Menschen im Hotel"", which became this Oscar-winning 1932 film","""Grand Hotel""",Grand Hotel,True,"Hotel Excelsior . The Excelsior was the inspiration for the novel ""Menschen im Hotel"" (1929) by the Austrian writer Vicki Baum (1888–1960). The book in turn inspired the Academy Award winning Hollywood film, ""Grand Hotel"". The hotel appears in Walter Ruttmann's 1927 film ."
34,1000,VICKI LEAKS,"Although she had 9 children, Queen Victoria was the last monarch of this royal house",House of Hanover,Hanover,True,"Queen Victoria . With a reign of 63 years, seven months and two days, Victoria was the longest-reigning British monarch and the longest-reigning queen regnant in world history until her great-great-granddaughter Elizabeth II surpassed her on 9 September 2015. She was the last monarch of Britain from the House of Hanover. Her son and successor Edward VII belonged to her husband's House of Saxe-Coburg and Gotha."
34,200,REALITY TV,"Alex Boyland & Chris Luca hit 5 continents & logged 52,000 miles to claim the $1 million prize on this CBS show","The Amazing Race 2"". They won two legs of the race, but escaped elimination when they ended up last in leg 6 in Thailand",The Amazing Race,True,"Alex Boylan . Alex Boylan teamed up with his lifelong friend Chris Luca to participate in ""The Amazing Race 2"". They won two legs of the race, but escaped elimination when they ended up last in leg 6 in Thailand as it was a non-elimination leg. The show gave some prominence to Boylan's friendship with a contestant from another team, Tara. Chris and Alex eventually won the race, narrowly beating Tara and Wil into second place in San Francisco with the closest finish in the history of the show."
34,400,REALITY TV,Jordan Lloyd was locked in a house & spied on 24/7 on this show to win $500K (which she said she'd use to buy a house!),"Karen McCluskey's house, telling her that she is old and may die soon, so she'd better sell her house now.",Big Brother,False,"The Thing That Counts Is What's Inside . Paul Young buys his old house on Wisteria Lane, in which he used to live with Mary Alice Young, his ex-wife, and their adopted son, Zach Young. He also shows interest in buying Karen McCluskey's house, telling her that she is old and may die soon, so she'd better sell her house now. Karen is angry at him and tells Beth about it. Beth, who agreed with Paul that there would not be anymore secrets between them, asks Paul if he talked to any of the neighbors and his answer is negative. Confused, Beth wonders what Paul is doing."
34,600,REALITY TV,"He wasn't afraid to talk about his band—that'd be Kiss, he'd have you know—on ""Family Jewels\""",,Gene Simmons,False,No Context
34,800,REALITY TV,Bravo! Heather Dubrow helped color the world of southern southern California on this reality show,"""The Real Housewives of Orange County""",The Real Housewives of Orange County,True,"Terry Dubrow . Terry J. Dubrow, M.D. (born September 14, 1958) is an American plastic surgeon and television personality. He is known for his work on ""The Swan"" and for co-hosting ""Botched"" with Dr. Paul Nassif. He also appears on ""The Real Housewives of Orange County"" with his wife, Heather. In 2015, Dubrow appeared on ""Good Work"", a plastic surgery-themed talk show, together with co-hosts RuPaul and Sandra Vergara. Dubrow also performed the plastic surgery procedures on ""Bridalplasty"", a reality series which premiered in 2011 and featured a group of women who competed in order to win a wedding and transformative plastic surgery procedure. In October 2015, the eight-episode spin-off series of ""Botched"" was announced entitled ""Botched by Nature"". The show premiered on August 9, 2016, starring Dr. Terry Dubrow."
34,1000,REALITY TV,"\""ANTM"" is short for this reality competition show",America's Next Top Model,America's Next Top Model,True,"Paulina Porizkova . Porizkova was part of the panel of judges on ""America's Next Top Model"" (""ANTM""), starting on Cycle 10 replacing the fashion icon, Twiggy. Porizkova continued to conduct regular weekly evaluations of ""ANTM"" participants on the show until she announced during a 12 May 2009 appearance on ""The Late Late Show with Craig Ferguson"" that she had been fired from the show. Although Porizkova maintained she was told by producers that she had an ""ego problem"", especially when she ""consistently complained"" about Tyra Banks' reported lateness to the set, ""ANTM"" executive producer Ken Mok and Banks released a statement claiming Porizkova's firing was due to ""the current state of the economy"", forcing ""ANTM"" to ""make major budget cuts ... unfortunately, Paulina was a casualty of these cuts."" When questioned by ABC news journalist Cynthia McFadden about the firing of Porizkova as well as former ""ANTM"" colleague, Janice Dickinson, both of whom had complained Banks was ""difficult"", Banks refused to address the issue."
34,200,20th CENTURY NOVELS,This book by Tolkien begins by telling us the title figure lived in a hole in the ground,"hobbit.""",The Hobbit,False,"The Hobbit . In a 1955 letter to W. H. Auden, Tolkien recollects that he began work on ""The Hobbit"" one day early in the 1930s, when he was marking School Certificate papers. He found a blank page. Suddenly inspired, he wrote the words, ""In a hole in the ground there lived a hobbit."" By late 1932 he had finished the story and then lent the manuscript to several friends, including C. S. Lewis and a student of Tolkien's named Elaine Griffiths. In 1936, when Griffiths was visited in Oxford by Susan Dagnall, a staff member of the publisher George Allen & Unwin, she is reported to have either lent Dagnall the book or suggested she borrow it from Tolkien. In any event, Dagnall was impressed by it, and showed the book to Stanley Unwin, who then asked his 10-year-old son Rayner to review it. Rayner's favourable comments settled Allen & Unwin's decision to publish Tolkien's book."
34,400,20th CENTURY NOVELS,"Alex, the narrator of this novel by Anthony Burgess, speaks Nadsat, a combination of Russian & Cockney English",linguist,A Clockwork Orange,False,"Nadsat . Nadsat is a fictional register or argot used by the teenagers in Anthony Burgess's novel ""A Clockwork Orange"". In addition to being a novelist, Burgess was a linguist and he used this background to depict his characters as speaking a form of Russian-influenced English. The name itself comes from the Russian suffix equivalent of ""-teen"" as in ""thirteen"" (-надцать, ""-nad·tsat&apos;""). Nadsat was also used in Stanley Kubrick's film adaptation of the book."
