SEASON,CLUE VALUE,CLUE CATEGORY,QUESTION,OUR MODEL_ANSWER,REAL ANSWER,CORRECT,CONTEXT USED
34,200,REJECTED GREETING CARDS,"\""Have fun in"" this country! ""But remember the State Department travel warning of Taliban insurgents in Kabul!\""","against the advice of the U.S. Department of State, and engaged in dealings and negotiations with Taliban officials until the collapse of the Taliban regime.",Afghanistan,False,"Global Relief Foundation . In November 2001, during the airstrikes in Afghanistan, a GRF medical relief coordinator traveled to Kabul, against the advice of the U.S. Department of State, and engaged in dealings and negotiations with Taliban officials until the collapse of the Taliban regime."
34,400,REJECTED GREETING CARDS,"\""It's OK, applicant! You didn't want to go to"" this Calif. university a 6-mile drive from the Googleplex ""anyway\""",University of Houston,Stanford,False,"Lauro Cruz . Born in Beaumont to Manuel Cruz and Margarita Menchaca, Lauro Cruz moved to Houston, Texas with his family when he was six months old, where his father owned and operated a grocery store. He enlisted for the United States Marine Corps Reserve during the Korean War in his second year of high school, and completed his GED in the Marines before being honorably discharged. Upon returning to Houston, he applied to be a bus driver with the Metropolitan Transit Authority of Harris County and became their first Mexican-American driver. Later, he decided he wanted to attend college, explaining ""I…wanted to go to college and the problem was I didn't know how to enroll. So, I just went over to the University of Houston and I said how do I get in here, you know? Somebody said you go to the admissions office and I said OK. Anyway, I ended up there."" He received a BA in Political Science from the University of Houston."
34,600,REJECTED GREETING CARDS,"\""Tummyache? Next time, take a close look at"" this ""C"" food ""casino"", made with wine, Parmesan & bacon",,clams,False,No Context
34,800,REJECTED GREETING CARDS,"\""Nice surgery! You finally vented"" this soft, purplish organ, that filters blood & stores platelets",The spleen,spleen,True,"Splenic injury . The spleen is an organ in the left upper quadrant of the abdomen that filters blood by removing old or damaged blood cells and platelets. While not essential to sustain life, the spleen performs protective immunological functions in the body. It also helps the immune system by destroying bacteria and other foreign substances by opsonization and phagocytosis, and by producing antibodies. It also stores approximately 33 percent of all platelets in the body."
34,1000,REJECTED GREETING CARDS,"\""Sorry you two had"" these 14-letter ""differences"" that couples often cite as legal grounds for divorce","""irreconcilable differences"",",irreconcilable,True,"Tony Parker . On 17 November 2010, Longoria filed for divorce in Los Angeles, citing ""irreconcilable differences"", and seeking spousal support from Parker. The couple had a prenuptial agreement that was signed in June 2007, the month before their wedding, and amended two years later in June 2009. Longoria believed that Parker had been cheating on her with another woman; ""Extra"" identified the other woman as Erin Barry, the wife of Brent Barry, Parker's former teammate, and revealed that the Barrys were also in the midst of a divorce. On 19 November 2010, Parker filed for divorce from Longoria in Bexar County, Texas on the grounds of ""discord or conflict of personalities"", thus establishing a legal battle over where the divorce case would be heard. Unlike Longoria's divorce petition, Parker's did not mention a prenuptial agreement and claimed that the parties ""will enter into an agreement for the division of their estate"". The divorce was finalized in Texas on 28 January 2011, the same day Longoria's lawyer filed papers to dismiss her Los Angeles petition."
34,600,NAME HER SPORT,Sue Bird,Bird played in a game against Notre Dame,basketball,False,"Sue Bird . During her junior year, Bird played in a game against Notre Dame referred to as ""the best women's basketball game ever played"". The game was memorialized in a book, ""Bird at the Buzzer"", in which Bird took the eponymous shot at the buzzer to win the game."
34,800,NAME HER SPORT,Gabrielle Reece,"January 6, 1970",volleyball,False,"Gabrielle Reece . Gabrielle Allyse Reece (born January 6, 1970) is an American professional volleyball player, sports announcer, fashion model and actress."
34,1000,NAME HER SPORT,Simona Halep,Simona Halep . Simona Halep,tennis,False,Simona Halep . Simona Halep
34,200,SELF-HELP BOOKS,"Don't procrastinate, get your copy of Eckhart Tolle's spiritual self-help book ""The Power of"" this",The Power of Now,now,False,"Eckhart Tolle . Eckhart Tolle ( ; , born Ulrich Leonard Tölle, February 16, 1948) is a spiritual teacher. He is a German-born resident of Canada best known as the author of ""The Power of Now"" and """". In 2008, a ""New York Times"" writer called Tolle ""the most popular spiritual author in the United States"". In 2011, he was listed by ""Watkins Review"" as the most spiritually influential person in the world. Tolle is not identified with any particular religion, but he has been influenced by a wide range of spiritual works."
34,400,SELF-HELP BOOKS,"In dealing with others, we need to set these lines, the title of a book subtitled ""When to Say Yes, How to Say No\""",,boundary,False,No Context
34,600,SELF-HELP BOOKS,"\""Quantum Healing"" & other books by this New Delhi-born man aim to put you on the path to wellness",Richard Feynman.,Deepak Chopra,False,"What Do You Care What Other People Think? . ""What Do You Care What Other People Think?"": Further Adventures of a Curious Character (1988) is the second of two books consisting of transcribed and edited, oral reminiscences from American physicist Richard Feynman. It follows ""Surely You're Joking, Mr. Feynman!"". Richard Feynman received the Nobel Prize in Physics in 1965 for his contributions to the development of quantum electrodynamics. He is a theoretical physicist known for his work in the path integral formulation of quantum mechanics, the theory of quantum electrodynamics, and the physics of the superfluidity of supercooled liquid helium, as well as in particle physics for which he proposed the parton model. For his contributions to the development of quantum electrodynamics, Feynman, jointly with Julian Schwinger and Shin'ichirō Tomonaga, was awarded the Nobel Prize in Physics in 1965."
34,800,SELF-HELP BOOKS,"One purpose of this evangelical leader's ""The Purpose Driven Life"" is to answer the question ""What am I here for?\""","""What is the meaning of life?"", pertains to the significance of living or existence in general.",Rick Warren,False,"Meaning of life . The meaning of life, or the answer to the question ""What is the meaning of life?"", pertains to the significance of living or existence in general. Many other related questions include: ""Why are we here?"", ""What is life all about?"", or ""What is the purpose of existence?"" There have been a large number of proposed answers to these questions from many different cultural and ideological backgrounds. The search for life's meaning has produced much philosophical, scientific, theological, and metaphysical speculation throughout history. Different people and cultures believe different things for the answer to this question."
34,1000,SELF-HELP BOOKS,"This self-help guru penned bestsellers like ""Your Erroneous Zones"" and ""The Power of Intention\""",Wayne Dyer,(Wayne) Dyer,False,"Your Erroneous Zones . Your Erroneous Zones is the first self-help book written by Wayne Dyer and issued on August 1, 1976. It is one of the top-selling books of all time, with an estimated 35 million copies sold. The book spent 64 weeks on ""The New York Times"" bestseller list through November 13, 1977, including a spot at number one on the week of May 8, 1977."
34,200,BACK IN BLACK,A slump in comic book sales drove it into bankruptcy in 1996; since then its cinematic universe alone has raked in $10 billion,"by the middle of the decade, the industry had slumped, and in December 1996 MEG",Marvel,False,"Marvel Comics . In late 1994, Marvel acquired the comic book distributor Heroes World Distribution to use as its own exclusive distributor. As the industry's other major publishers made exclusive distribution deals with other companies, the ripple effect resulted in the survival of only one other major distributor in North America, Diamond Comic Distributors Inc. Then, by the middle of the decade, the industry had slumped, and in December 1996 MEG filed for Chapter 11 bankruptcy protection. In early 1997, when Marvel's Heroes World endeavor failed, Diamond also forged an exclusive deal with Marvel—giving the company its own section of its comics catalog ""Previews""."
34,400,BACK IN BLACK,"On the verge of going bust in 1997, it was saved by a $150 million investment by rival Microsoft",,Apple,False,No Context
34,600,BACK IN BLACK,It went from filing for bankruptcy in 2011 to merging with U.S. Airways & becoming the world's largest airline in 2014,"American Airlines' parent company AMR Corporation filed for bankruptcy protection. In 2013, US Airways merged with American Airlines",American Airlines,True,"American Airlines . In 2011, due to a downturn in the airline industry, American Airlines' parent company AMR Corporation filed for bankruptcy protection. In 2013, US Airways merged with American Airlines but kept the American Airlines name, as it was the better recognized brand internationally; the combination of the two airlines resulted in the creation of the largest airline in the United States, and ultimately the world."
34,800,BACK IN BLACK,"It took more than a ""moment"", but this Rochester, N.Y. company emerged from bankruptcy & still sells cameras",,Kodak,False,No Context
34,1000,BACK IN BLACK,"U.S. taxpayers ponied up $180 billion to rescue this 3-letter insurance co., but got it all back, plus a profit","AIG,",AIG,True,"Bob Benmosche . On December 14, 2012, Benmosche announced that the U.S. government and American taxpayers received their full investment in AIG, plus a $22 billion positive return. Benmosche's management has been credited with leading the company back to profitability, the full repayment to the Federal Reserve Bank of New York, reducing the Treasury Department’s stake in AIG to below 20% and the repayment of the 2008 $85 billion federal loan."
34,200,HIGHWAY TO HELL,"Route 495 takes those in New Jersey to Hell's Kitchen via this ""presidential"" tunnel",Lincoln Tunnel,the Lincoln Tunnel,True,"Union City, New Jersey . Bergenline Avenue and the marginal highway of New Jersey Route 495 are major public transportation corridors. Union City is from New York City via the Lincoln Tunnel, its main approach road, Route 495 bisecting it. Within a mile to the west are U.S. Route 1/9, Route 3, and the New Jersey Turnpike."
34,400,HIGHWAY TO HELL,This state's Highway 67 will get you a nice view of Devils Head Mountain in Pike National Forest,southwest by south,Colorado,False,"Devils Head (summit) . Devils Head is a mountain summit in the Rampart Range of the Rocky Mountains of North America. The peak is located in Pike National Forest, southwest by south (bearing 210°) of the community of Sedalia in Douglas County, Colorado, United States."
34,600,HIGHWAY TO HELL,"West of Akron, Route 57 takes you over this 4-letter river, & you don't have to pay a toll to Charon",,the Styx,False,No Context
34,800,HIGHWAY TO HELL,Take the 395 in this state to Inyo National Forest and to Devils Postpile along the middle fork of the San Joaquin River,"Middle Fork of the San Joaquin River, from where it flowed to the site of the Postpile.",California,False,"Devils Postpile National Monument . The name ""Devils Postpile"" refers to a dark cliff of columnar basalt. Radiometric dating indicates the formation was created by a lava flow at some time less than 100,000 years ago. The source of the lava is thought to have been somewhere near Upper Soda Springs campground at the north end of Pumice Flat on the floor of the Middle Fork of the San Joaquin River, from where it flowed to the site of the Postpile. Estimates of the formations thickness range from to . The lava that now makes up the Postpile was near the bottom of this mass."
34,1000,HIGHWAY TO HELL,"Highway 71 gets you to America's deepest gorge, Hells Canyon, & this river that flows through it",Snake River,the Snake,False,"Hells Canyon Wilderness (Oregon and Idaho) . The Hells Canyon Wilderness is a wilderness area in the western United States, in Idaho and Oregon. Created in 1975, the Wilderness is managed by both the U.S. Bureau of Land Management and the U.S. Forest Service and contains some of the most spectacular sections of the Snake River as it winds its way through Hells Canyon, North America's deepest river gorge and one of the deepest gorges on Earth. The Oregon Wilderness Act of 1984 added additional acreage and currently the area protects a total area of . It lies entirely within the Hells Canyon National Recreation Area except for a small plot in southeastern Wallowa County, Oregon which is administered by the Bureau of Land Management. The area that is administered by the Forest Service consists of portions of (in descending order of acreage) the Wallowa, Nez Perce, Payette, and Whitman National Forests."
34,200,"\""A-C""/""D-C\""","It means ""severe"", as in ""we have to resort to"" these ""measures\""",,drastic,False,No Context
34,400,"\""A-C""/""D-C\""",Term for someone who can't remember who he is,"""mysterious waif""",amnesiac,False,"Ten Days in a Mad-House . Several doctors then examined her; all declared her insane. ""Positively demented,"" said one, ""I consider it a hopeless case. She needs to be put where someone will take care of her."" The head of the insane pavilion at Bellevue Hospital pronounced her ""undoubtedly insane"". The case of the ""pretty crazy girl"" attracted media attention: ""Who Is This Insane Girl?"" asked the ""New York Sun"". ""The New York Times"" wrote of the ""mysterious waif"" with the ""wild, haunted look in her eyes"" and her desperate cry: ""I can't remember I can't remember."""
34,600,"\""A-C""/""D-C\""",Late in 2016 President Obama expelled from the U.S. several Russian members of this corps,Washington's expulsion of 35 Russian diplomats,the diplomatic corps,False,"Russia–United States relations . At the end of 2016, U.S. president-elect Donald Trump praised Russian president Vladimir Putin for not expelling U.S. diplomats in response to Washington's expulsion of 35 Russian diplomats as well as other punitive measures taken by the Obama administration in retaliation for what U.S. officials had characterized as interference in the U.S. presidential election."
34,800,"\""A-C""/""D-C\""","Meaning ""antiquated"", it has nothing to do with a Biblical boat",eye,archaic,False,"Apple of my eye . The original Hebrew for this idiom, in all but Zechariah 2:8, was 'iyshown 'ayin (אישון עין). The expression refers to the pupil, and probably simply means ""dark part of the eye"" (other biblical passages use 'iyshown with the meaning ""dark"" or""obscure"", and having nothing whatsoever to do with the eye). There is, however, a popular notion that 'iyshown is a diminutive of ""man"" ('iysh), so that the expression would literally mean ""Little Man of the Eye."""
34,1000,"\""A-C""/""D-C\""",St. Nilus of Ancyra was AKA Nilus the this type of monk who lives simply,Russian Orthodox,ascetic,False,"Nilus of Sinai . These prophecies likely originated from the Russian Orthodox St. Nilus, called Nilus of Sora, but has been wrongly attributed to Nilus of Sinai. Between the years 1813 and 1819, a certain monk named Theophanes, also known as the “Prisoner”, was troubled by a demon due to his many sins, and he also suffered from a hernia. In despair over his condition he planned to leave the Holy Mountain until one day St. Nilus appeared to him. St. Nilus showed him an abandoned hut and instructed him to settle there, promising to provide for his needs. Theophanes obeyed, although at first he did not know it was St. Nilus - only later did the Saint reveal himself."
34,400,ARCHITECTURE,The flamboyant type of this medieval style of architecture features curves in the tracery that resemble flames,double curved tracery.,gothic,False,"Flamboyant . Flamboyant (from French ""flamboyant"", ""flaming"") is the name given to a florid style of late Gothic architecture in vogue in France from about 1350, until it was superseded by Renaissance architecture during the early 16th century. The term has been mainly used to describe French buildings and sometimes the early period of English Gothic architecture, usually called the Decorated Style; the historian Edward Augustus Freeman proposed this in a work of 1851. A version of the style spread to Spain and Portugal during the 15th century. It evolved from the Rayonnant style and the English Decorated Style and was marked by even greater attention to decoration and the use of double curved tracery. The term was first used by Eustache-Hyacinthe Langlois (1777–1837), and like all the terms mentioned in this paragraph except ""Sondergotik"" describes the style of window tracery, which is much the easiest way of distinguishing within the overall Gothic period, but ignores other aspects of style. In England the later part of the period is known as Perpendicular architecture. In Germany Sondergotik (""Special Gothic"") is the more usual term."
34,800,ARCHITECTURE,This uppermost part of the capital of a column shares its name with an ancient calculator,stylobate.,an abacus,False,"Ancient Greek temple . Stereobate, ""euthynteria"" and ""crepidoma"" form the substructure of the temple. The underground foundation of a Greek temple is known as the stereobate. It consists of several layers of squared stone blocks. The uppermost layer, the ""euthynteria"", partially protrudes above the ground level. Its surface is carefully smoothed and levelled. It supports a further foundation of three steps, the ""crepidoma"". The uppermost level of the ""crepidoma"" provides the surface on which the columns and walls are placed; it is called stylobate."
34,1600,ARCHITECTURE,"Flat roofs & lots of glass were a trend around 1950, thus the alliterative term this period ""modern\""",,mid-century,False,No Context
34,2000,ARCHITECTURE,"In 1923 this Swiss mister with a French nom de architecture wrote, ""A house is a machine for living in\""",Le Corbusier,Le Corbusier,True,"Functionalism (architecture) . Popular notions of modern architecture are heavily influenced by the work of the Franco-Swiss architect Le Corbusier and the German architect Mies van der Rohe. Both were functionalists at least to the extent that their buildings were radical simplifications of previous styles. In 1923 Mies van der Rohe was working in Weimar Germany, and had begun his career of producing radically simplified, lovingly detailed structures that achieved Sullivan's goal of inherent architectural beauty. Le Corbusier famously said ""a house is a machine for living in""; his 1923 book ""Vers une architecture"" was, and still is, very influential, and his early built work such as the Villa Savoye in Poissy, France, is thought of as prototypically function."
34,400,COMEDY TONIGHT!,"She headed to Netflix for ""The Leather Special\""",Amy Schumer:,Amy Schumer,True,"Amy Schumer: The Leather Special . Netflix released the special on March 7, 2017."
34,800,COMEDY TONIGHT!,"This gravel-voiced funny guy won a Grammy for his comedy album ""Stark Raving Black\""",Lewis Black,Lewis Black,True,"Stark Raving Black . ""Stark Raving Black"" is the seventh album by comedian Lewis Black, released through Comedy Central Records. Containing the audio of a concert stand-up special of the same name. The album was awarded the 2011 Grammy Award for Best Comedy Album."
34,1600,COMEDY TONIGHT!,"He asked, ""Do you think that God gets stoned once in a while? Look at a platypus. I think so\""","every once in a while you got to do this kind of thing, you got to put somebody in their place",Robin Williams,False,"Ballad of a Thin Man . In March 1986, Dylan told his audience in Japan: ""This is a song I wrote a while back in response to people who ask me questions all the time. You just get tired of that every once in a while. You just don't want to answer no more questions. I figure a person’s life speaks for itself, right? So, every once in a while you got to do this kind of thing, you got to put somebody in their place... So this is my response to something that happened over in England. I think it was about '63, '64. [sic] Anyway the song still holds up. Seems to be people around still like that. So I still sing it. It's called 'Ballad Of A Thin Man'."""
34,2000,COMEDY TONIGHT!,"George Carlin said, ""Scientists have discovered a vaccine for"" this, but ""no one is showing the slightest interest\""",,apathy,False,No Context
34,400,NICKNAMES,This type of body of water is in a nickname for Massachusetts,the hardest working river in the county,bay,False,"Bear Swamp Hydroelectric Power Station . Bear Swamp Generating Station or Jack Cockwell Station is a pumped-storage hydroelectric underground power station that straddles the Deerfield River in Rowe and Florida, Massachusetts. It is one of many hydroelectric facilities along the river, giving that waterway the nickname of ""the hardest working river in the county"". The reservoir covers , storing about 1.7 billion gallons at an elevation of above sea level, higher than the lower reservoir. To move the huge volumes of water (8,800 cubic feet per second uphill and 10,760 cf/s downhill) in both directions, Bear Swamp uses reversible water turbines of the Francis type."
34,800,NICKNAMES,"(Sarah of the Clue Crew shows a diagram of troop movements on the monitor.) At the first Battle of Bull Run, Union troops threatened a decisive breakthrough but couldn't get past a Virginia brigade, earning its commander this nickname","35,000, although only about 18,000 were actually engaged",Stonewall,False,"First Battle of Bull Run . McDowell's Army of Northeastern Virginia was organized into five infantry divisions of three to five brigades each. Each brigade contained three to five infantry regiments. An artillery battery was generally assigned to each brigade. The total number of Union troops present at the Battle of First Bull Run was about 35,000, although only about 18,000 were actually engaged. The Union army was organized as follows: While McDowell organized the Army of Northeastern Virginia, a smaller Union command was organized and stationed northwest of Washington, near Harper's Ferry. Commanded by Maj. Gen. Robert Patterson, 18,000 men of the Department of Pennsylvania protected against a Confederate incursion from the Shenandoah Valley."
34,1200,NICKNAMES,"A gaudy, glittering metallic substance is in this nickname for the L.A. movie industry",Glam metal,Tinseltown,False,"Glam metal . Aesthetically glam metal draws heavily on the glam rock or glitter rock of the 1970s, often with very long backcombed hair, use of make-up, gaudy clothing and accessories (chiefly consisting of tight denim or leather jeans, spandex, and headbands). The visual aspects of glam metal appealed to music television producers, particularly MTV, whose establishment coincided with the rise of the genre. Glam metal performers became infamous for their debauched lifestyles of drugs, strippers and late-night parties, which were widely covered in the tabloid press."
34,1600,NICKNAMES,Robert A. Lewis was the co-pilot of the plane with this nickname that dropped the A-bomb on Hiroshima,"""Enola Gay"",",the Enola Gay,False,"This Is Your Life . One of the show's subjects was Rev. Kiyoshi Tanimoto, a survivor of the atomic bombing of Hiroshima. During the episode Edwards introduced Tanimoto to Robert A. Lewis, the co-pilot of the ""Enola Gay"", the plane that dropped the bomb on Hiroshima. Hanna Bloch Kohner, a Holocaust survivor, was a subject on May 27, 1953."
34,2000,NICKNAMES,"Alexander Pope's nicknames include ""The Bard of Twickenham"" & ""The Sweet"" this bird ""of Thames\""",poet,The Sweet Swan of Thames,False,"Peter Tillemans . Tillemans painted several topographical works of views in Richmond and Twickenham, to the west of London, including ""A View of Richmond from Twickenham Park"" (later engraved by P. Benazech), ""A View from Richmond Hill"" and ""The Thames at Twickenham"" (known also as ""A Prospect of Twickenham""). This last painting, the ""earliest complete topographical view of the river frontage in the 18th century"", was commissioned either by the poet Alexander Pope (his villa by the Thames is shown in the painting) or John Robartes, later 4th Earl of Radnor. His panorama of ""The Thames from Richmond Hill"" (""c."" 1723) was one of three paintings done for the Earl of Radnor."
34,400,HISTORY OF SCIENCE,This man announced his periodic law of the elements before the Russian Chemical Society in 1869,Dmitri Ivanovich Mendeleev,Mendeleyev,False,"Germanium . In his report on ""The Periodic Law of the Chemical Elements"" in 1869, the Russian chemist Dmitri Ivanovich Mendeleev predicted the existence of several unknown chemical elements, including one that would fill a gap in the carbon family in his Periodic Table of the Elements, located between silicon and tin. Because of its position in his Periodic Table, Mendeleev called it ""ekasilicon (Es)"", and he estimated its atomic weight to be about 72.0."
